<?xml version="1.0" encoding="UTF-8" ?>
<plugin xmlns="http://portato.sourceforge.net/plugin" xmlns:xsi="http://www.w3.org/2001/XMLSchema-instance" xsi:schemaLocation="http://portato.sourceforge.net/plugin http://portato.sourceforge.net/plugin.xsd">
	<author>René 'Necoro' Neumann</author>
	<name>Shutdown</name>
	<import>portato.plugins.shutdown</import>

	<hooks>
		<hook type = "after_emerge"	call = "shutdown">
			<connect type="after">*</connect>
		</hook>
	</hooks>

	<options>
		<option>disabled</option>
	</options>
</plugin>
